{
 "schema_version": "1.1",
 "artifact_kind": "rerank_result",
 "run_id": "langexp1023-opus-v2-nz-s5",
 "bug_id": "Lang-8",
 "input_sha256": "4dbb2f63a8ce6b9bea21fd3da5f4bb1a2c194f7d1f80715f28896b6b6166ac1f",
 "status": "complete",
 "created_at": "2026-10-26T05:28:17Z",
 "config": {
  "model_key": "opus",
  "provider": "anthropic",
  "model": "claude-opus-5-5",
  "effort": "low",
  "max_tokens": 8000,
  "prompt_version": "v2",
  "num_samples": 5,
  "effective_num_samples": 5,
  "transport": "messages",
  "candidate_set": "nonzero",
  "prompt_sha256": "9b6ef534651a87e5595d30e7047fb93348024228a4a4d87b9aa007ade316d72b",
  "code": {
   "git_revision": "fc9946d63bc26716dc621fcb1d4f7456ff98ebcf",
   "git_dirty": false,
   "code_sha256": "8aca713913e872a45cac8c1755f4e215b6e5297e4a4ef1d5109183738da7da54"
  },
  "sampling": {
   "num_samples": 5,
   "base_seed": 527,
   "order": "shuffle",
   "adaptive": {
    "enabled": false,
    "single_sample_max_shown": 2
   }
  },
  "context": {
   "token_budget": 12000,
   "chars_per_token": 2.4,
   "drop_zero_score": true,
   "show_sbfl_scores": false,
   "max_jdk_frames": 4,
   "max_project_frames": 12,
   "include_test_helpers": true,
   "max_helper_lines": 40,
   "max_full_tests": 3,
   "per_candidate_overhead_chars": 40
  },
  "validation": {
   "max_attempts": 2
  },
  "fusion": {
   "method": "weighted_rank",
   "weights": [
    0.0,
    0.25,
    0.5,
    0.75,
    1.0
   ],
   "primary_weight": 0.5,
   "rrf_k": 60
  }
 },
 "context": {
  "shown": [
   "src/main/java/org/apache/commons/lang3/time/FastDateParser.java::org.apache.commons.lang3.time.FastDateParser$TextStrategy#isNumber()",
   "src/main/java/org/apache/commons/lang3/time/FastDatePrinter.java::org.apache.commons.lang3.time.FastDatePrinter$TwelveHourField#appendTo(StringBuffer,Calendar)",
   "src/main/java/org/apache/commons/lang3/time/FastDatePrinter.java::org.apache.commons.lang3.time.FastDatePrinter$TimeZoneNameRule#appendTo(StringBuffer,Calendar)",
   "src/main/java/org/apache/commons/lang3/time/FastDatePrinter.java::org.apache.commons.lang3.time.FastDatePrinter$TimeZoneDisplayKey#equals(Object)",
   "src/main/java/org/apache/commons/lang3/time/FastDatePrinter.java::org.apache.commons.lang3.time.FastDatePrinter$UnpaddedNumberField#appendTo(StringBuffer,int)",
   "src/main/java/org/apache/commons/lang3/time/FastDatePrinter.java::org.apache.commons.lang3.time.FastDatePrinter#getTimeZoneDisplay(TimeZone,boolean,int,Locale)",
   "src/main/java/org/apache/commons/lang3/time/FastDatePrinter.java::org.apache.commons.lang3.time.FastDatePrinter#parsePattern()",
   "src/main/java/org/apache/commons/lang3/time/FastDatePrinter.java::org.apache.commons.lang3.time.FastDatePrinter$TextField#appendTo(StringBuffer,Calendar)",
   "src/main/java/org/apache/commons/lang3/time/FastDatePrinter.java::org.apache.commons.lang3.time.FastDatePrinter$TimeZoneDisplayKey#<init>(TimeZone,boolean,int,Locale)",
   "src/main/java/org/apache/commons/lang3/time/FastDatePrinter.java::org.apache.commons.lang3.time.FastDatePrinter$TimeZoneDisplayKey#hashCode()",
   "src/main/java/org/apache/commons/lang3/time/FastDatePrinter.java::org.apache.commons.lang3.time.FastDatePrinter$TimeZoneNameRule#<init>(TimeZone,Locale,int)",
   "src/main/java/org/apache/commons/lang3/time/FastDatePrinter.java::org.apache.commons.lang3.time.FastDatePrinter$TimeZoneNameRule#estimateLength()",
   "src/main/java/org/apache/commons/lang3/time/FastDatePrinter.java::org.apache.commons.lang3.time.FastDatePrinter$TwelveHourField#<init>(NumberRule)",
   "src/main/java/org/apache/commons/lang3/time/FastDatePrinter.java::org.apache.commons.lang3.time.FastDatePrinter$TwelveHourField#estimateLength()",
   "src/main/java/org/apache/commons/lang3/time/FastDatePrinter.java::org.apache.commons.lang3.time.FastDatePrinter#selectNumberRule(int,int)",
   "src/main/java/org/apache/commons/lang3/time/FastDatePrinter.java::org.apache.commons.lang3.time.FastDatePrinter$UnpaddedNumberField#<init>(int)",
   "src/main/java/org/apache/commons/lang3/time/FastDatePrinter.java::org.apache.commons.lang3.time.FastDatePrinter$UnpaddedNumberField#estimateLength()",
   "src/main/java/org/apache/commons/lang3/time/FastDateParser.java::org.apache.commons.lang3.time.FastDateParser#getStrategy(String,Calendar)",
   "src/main/java/org/apache/commons/lang3/time/FastDateFormat.java::org.apache.commons.lang3.time.FastDateFormat#format(Calendar)",
   "src/main/java/org/apache/commons/lang3/time/FastDateFormat.java::org.apache.commons.lang3.time.FastDateFormat#getInstance(String)"
  ],
  "dropped": [],
  "truncated": [],
  "stack_marked_candidates": [],
  "estimated_tokens": 9695,
  "helpers_omitted_for_budget": false,
  "helpers_included": true
 },
 "rankings": {
  "sbfl": [
   "src/main/java/org/apache/commons/lang3/time/FastDateParser.java::org.apache.commons.lang3.time.FastDateParser$TextStrategy#isNumber()",
   "src/main/java/org/apache/commons/lang3/time/FastDatePrinter.java::org.apache.commons.lang3.time.FastDatePrinter$TwelveHourField#appendTo(StringBuffer,Calendar)",
   "src/main/java/org/apache/commons/lang3/time/FastDatePrinter.java::org.apache.commons.lang3.time.FastDatePrinter$TimeZoneNameRule#appendTo(StringBuffer,Calendar)",
   "src/main/java/org/apache/commons/lang3/time/FastDatePrinter.java::org.apache.commons.lang3.time.FastDatePrinter$TimeZoneDisplayKey#equals(Object)",
   "src/main/java/org/apache/commons/lang3/time/FastDatePrinter.java::org.apache.commons.lang3.time.FastDatePrinter$UnpaddedNumberField#appendTo(StringBuffer,int)",
   "src/main/java/org/apache/commons/lang3/time/FastDatePrinter.java::org.apache.commons.lang3.time.FastDatePrinter#getTimeZoneDisplay(TimeZone,boolean,int,Locale)",
   "src/main/java/org/apache/commons/lang3/time/FastDatePrinter.java::org.apache.commons.lang3.time.FastDatePrinter#parsePattern()",
   "src/main/java/org/apache/commons/lang3/time/FastDatePrinter.java::org.apache.commons.lang3.time.FastDatePrinter$TextField#appendTo(StringBuffer,Calendar)",
   "src/main/java/org/apache/commons/lang3/time/FastDatePrinter.java::org.apache.commons.lang3.time.FastDatePrinter$TimeZoneDisplayKey#<init>(TimeZone,boolean,int,Locale)",
   "src/main/java/org/apache/commons/lang3/time/FastDatePrinter.java::org.apache.commons.lang3.time.FastDatePrinter$TimeZoneDisplayKey#hashCode()",
   "src/main/java/org/apache/commons/lang3/time/FastDatePrinter.java::org.apache.commons.lang3.time.FastDatePrinter$TimeZoneNameRule#<init>(TimeZone,Locale,int)",
   "src/main/java/org/apache/commons/lang3/time/FastDatePrinter.java::org.apache.commons.lang3.time.FastDatePrinter$TimeZoneNameRule#estimateLength()",
   "src/main/java/org/apache/commons/lang3/time/FastDatePrinter.java::org.apache.commons.lang3.time.FastDatePrinter$TwelveHourField#<init>(NumberRule)",
   "src/main/java/org/apache/commons/lang3/time/FastDatePrinter.java::org.apache.commons.lang3.time.FastDatePrinter$TwelveHourField#estimateLength()",
   "src/main/java/org/apache/commons/lang3/time/FastDatePrinter.java::org.apache.commons.lang3.time.FastDatePrinter#selectNumberRule(int,int)",
   "src/main/java/org/apache/commons/lang3/time/FastDatePrinter.java::org.apache.commons.lang3.time.FastDatePrinter$UnpaddedNumberField#<init>(int)",
   "src/main/java/org/apache/commons/lang3/time/FastDatePrinter.java::org.apache.commons.lang3.time.FastDatePrinter$UnpaddedNumberField#estimateLength()",
   "src/main/java/org/apache/commons/lang3/time/FastDateParser.java::org.apache.commons.lang3.time.FastDateParser#getStrategy(String,Calendar)",
   "src/main/java/org/apache/commons/lang3/time/FastDateFormat.java::org.apache.commons.lang3.time.FastDateFormat#format(Calendar)",
   "src/main/java/org/apache/commons/lang3/time/FastDateFormat.java::org.apache.commons.lang3.time.FastDateFormat#getInstance(String)"
  ],
  "mean": [
   "src/main/java/org/apache/commons/lang3/time/FastDatePrinter.java::org.apache.commons.lang3.time.FastDatePrinter$TimeZoneNameRule#appendTo(StringBuffer,Calendar)",
   "src/main/java/org/apache/commons/lang3/time/FastDatePrinter.java::org.apache.commons.lang3.time.FastDatePrinter$TimeZoneNameRule#<init>(TimeZone,Locale,int)",
   "src/main/java/org/apache/commons/lang3/time/FastDatePrinter.java::org.apache.commons.lang3.time.FastDatePrinter#parsePattern()",
   "src/main/java/org/apache/commons/lang3/time/FastDatePrinter.java::org.apache.commons.lang3.time.FastDatePrinter#getTimeZoneDisplay(TimeZone,boolean,int,Locale)",
   "src/main/java/org/apache/commons/lang3/time/FastDatePrinter.java::org.apache.commons.lang3.time.FastDatePrinter$TimeZoneNameRule#estimateLength()",
   "src/main/java/org/apache/commons/lang3/time/FastDateFormat.java::org.apache.commons.lang3.time.FastDateFormat#format(Calendar)",
   "src/main/java/org/apache/commons/lang3/time/FastDatePrinter.java::org.apache.commons.lang3.time.FastDatePrinter$TimeZoneDisplayKey#<init>(TimeZone,boolean,int,Locale)",
   "src/main/java/org/apache/commons/lang3/time/FastDateFormat.java::org.apache.commons.lang3.time.FastDateFormat#getInstance(String)",
   "src/main/java/org/apache/commons/lang3/time/FastDatePrinter.java::org.apache.commons.lang3.time.FastDatePrinter$TimeZoneDisplayKey#equals(Object)",
   "src/main/java/org/apache/commons/lang3/time/FastDatePrinter.java::org.apache.commons.lang3.time.FastDatePrinter$TimeZoneDisplayKey#hashCode()",
   "src/main/java/org/apache/commons/lang3/time/FastDatePrinter.java::org.apache.commons.lang3.time.FastDatePrinter$TextField#appendTo(StringBuffer,Calendar)",
   "src/main/java/org/apache/commons/lang3/time/FastDatePrinter.java::org.apache.commons.lang3.time.FastDatePrinter$TwelveHourField#appendTo(StringBuffer,Calendar)",
   "src/main/java/org/apache/commons/lang3/time/FastDatePrinter.java::org.apache.commons.lang3.time.FastDatePrinter$TwelveHourField#<init>(NumberRule)",
   "src/main/java/org/apache/commons/lang3/time/FastDatePrinter.java::org.apache.commons.lang3.time.FastDatePrinter#selectNumberRule(int,int)",